<?xml version="1.0" encoding="UTF-8"?>
<Person xmlns="http://ts-reaktive/test"
        xmlns:xsi="http://www.w3.org/2001/XMLSchema-instance" 
        xsi:schemaLocation="http://ts-reaktive/test sample.xsd">
  <PersonId>8fb40607-240a-4eb4-b847-db47c9c41751</PersonId>
  <Name language="en:US">John Smith</Name>
  <Address>
    <Street>Main st. 5</Street>
    <City>Bigtown</City>
  </Address>
  <Parent>
    <PersonId>0f048c9f-063d-430e-af03-8012cd7667f1</PersonId>
    <Name language="en:US">Jane Smith</Name>
    <Pet>
      <Name>Alice</Name>
    </Pet>
    <Pet>
      <Name>Bob</Name>
    </Pet>
  </Parent>
</Person>